,Titulo,Texto,Tamanho,Bom,Nao_Bom,Ruim,Nao_Ruim,Comida,Atendimento,Preço,Lugar,Outros
201,Surpresa boa,"Apesar do cardápio ""enxuto"" a comida é gostosa e farta e o ambiente é agradável. Simples mesmo  mas com estilo",12,0,0,0,0,0,0,0,0,0
202,Almoço bem servido!,"Fui conhecer o novo restaurante do Dudu Camargo  em Aguas Claras  durante um almoço de fim de semana. Cheguei 12h15 e o restaurante já estava lotado! Entendi que o restaurante tem uma proposta TOTALMENTE diferente dos demais restaurantes comandados pelo Chef. ""Simples Assim"" é realmente...Mais",19,0,0,0,0,0,0,0,0,0
203,Jantar bem servido,Com opções de galeto e parmegiana é uma ótima opção para um jantar em familia ou com amigos. Os pratos sao super bem servidos e a sobremesa é sensacional. Peçam o pudim que é muito bom.,18,0,0,0,0,0,0,0,0,0
204,Lugar agradável ,Boa comida  bom ambiente... um espaço muito aconchegante com preço justo. Ótimo lugar para um café da manhã fora de casa.,16,0,0,0,0,0,0,0,0,0
205,Funcionarios despreparados,Cliente freqüente  sempre considerei a comida razoável para o preço  porém os funcionários são despreparados  mal educados  a comida demora a sair  e quando reclama você é mal tratado,26,0,0,0,0,0,0,0,0,0
206,Chopp gelado  porém aguado. Atendimento ruim. Preços normais para Brasília.,Chopp gelado  porém aguado. Comida muito boa  vale a pena pedir o rodízio. Atendimento ruim  principalmente quando há muita gente na mesa. Garçons deixam de marcar ou marcam itens a mais. O preço no happy hour vale a pena  no restante o preço é o...Mais,75,0,0,0,0,0,0,0,0,0
207,Não vale a pena.,Os garçons são bem atenciosos mas são poucos  sobrecarregando o trabalho deles e condenando a experiência. A opção de rodízio de petisco demora muito pra sair os pratos  levou mais de meia hora para passar um mini-hamburguer (realmente mais de meia hora contei o tempo) e...Mais,16,0,0,0,0,0,0,0,0,0
208,Padrão americano ,Cerveja bem gelada  onion rings muito bons e uma bela variedade de burgers e aperitivos americanos. O sanduíche não achei espetacular  no entanto.,17,0,0,0,0,0,0,0,0,0
209,Calzone do CNB/a/2028: rede de calzones e lanches rápidos,Detalhes: comida boa para lanches = deliciosa  bem preparada e servida - atendimento bom - preço razoável,57,0,0,0,0,0,0,0,0,0
210,BOM,Comida sem surpresa  como todos os restaurantes da rede  boa como sempre para matar aquela fome repentina.,3,0,0,0,0,0,0,0,0,0
211,Caiu muito o padrão,Estive lá hoje com minha esposa e pedi dois kalzone e os dois vieram com a massa crua. Não entendo isso  pois não é a primeira vez em que a massa está vindo crua. Quando comecei a comer lá  era muito bom  muito bom mesmo....Mais,19,0,0,0,0,0,0,0,0,0
212,Gostoso,Lanche rápido  saboroso e de preço acessível. Entretanto  o atendimento na unidade do Conjunto Nacional sempre é lento  filas são frequentes.,7,0,0,0,0,0,0,0,0,0
213,Perfeito,Parabéns! Sou fregueses assíduo há tempo! Minha família adora! Lugar muito bonito e comidas deliciosas.,8,0,0,0,0,0,0,0,0,0
214,Perfeito para um lanche rápido,Atendimento muito bom e qualidade do que nos foi oferecido  mantém o mesmo padrão dos demais locais que comemos mini Kazone  perfeito quando você deseja um lanche rápido.,30,0,0,0,0,0,0,0,0,0
215,Excelente atendimento,DELICIOSO e excelente atendimento. Valor acessível e local agradável para se lanchar. Ambiente acolhedor e familiar.,21,0,0,0,0,0,0,0,0,0
216,Rodízio de pizza e buffet ,Todas as segundas-feiras o rodízio de pizzas e buffet a vontade é mais barato  atualmente está R$ 10 90 por pessoa neste dia. Pizzas e buffet bons pelo valor. Vale a pena. O atendimento do rodízio fica mais lento quando a casa vai enchendo muito. Uma...Mais,26,0,0,0,0,0,0,0,0,0
217,Mentiram e enganaram,Fui lá no mês de abril ou maio. Pedi uma porção de filé com fritas e não era filé. Isso é safadeza e falta de caráter. Recomendo não irem por um bom tempo.,20,0,0,0,0,0,0,0,0,0
218,Pior rodízio,Um custo beneficio muito bom  mas apenas isso. O ambiente é muito ruim  a música não é boa  a decoração é interessante mas a luz dá um pouco de agonia por ser amarelada  tem uma quantidade considerável de petiscos  achei que teria mais opção de...Mais,12,0,0,0,0,0,0,0,0,0
219,Condiz com o preço ...,O ambiente não tem uma boa disposição de mesas  se você for de 2 ou 3 pessoas as mesas são de localização ruim. O atendente do caixa ao nos receber (autentificar o Groupon) foi de total falta de educação. Os garçons são educados porém a...Mais,22,0,0,0,0,0,0,0,0,0
220,Gostei do local,Uma opção tranquila com bons drinks e comida boa  só não sei se podemos chame de pub  pois tem hora para acabar  no mais acho que vale uma passada.,15,0,0,0,0,0,0,0,0,0
221,Boa opcao,É um restaurante a quilo  com boa variedade e preço bom. A maioria das carnes estava bem secas  muito além do bem passado  o que pode ser melhorado pelo restaurante. No geral é um bom restaurante para o dia a dia.,9,0,0,0,0,0,0,0,0,0
222,Opção na Asa Norte,Restaurante por kilo  com ótimo custo-benefício. Variedade de carnes e acompanhamentos. Ótima opção para refeições diárias.,18,0,0,0,0,0,0,0,0,0
223,Desagradável,O lugar e legal e a comida não é ruim. Mas o atendimento e de péssima qualidade. Experimentei um crepe onde a carne estava com gosto estranho  meio passada. Informei a garçonete que queria devolver o prato e a mesma além de não querer recolher...Mais,12,0,0,0,0,0,0,0,0,0
224,Crepe delicioso!,O crepe servido estava delicioso  o atendimento foi um pouco demorado  mas com bastante cortesia. O cardápio é bem variado oferecendo opções inclusive para quem está de dieta! Voltarei!,16,0,0,0,0,0,0,0,0,0
225,Não volto,CheesecAke super velho! Horrível! Café aguado! Não provei outras coisas mas todas as tortas estavam com cara de velha,9,0,0,0,0,0,0,0,0,0
226,Cafés Especias e Crepes no Terraço Shopping!,O Victoria Café Creperia fica na praça de alimentação do Terraço Shopping  o cardápio contempla vários tipos de cafés especiais e diversos crepes  salgados e doces  os crepes são bem servidos e saborosos  pra quem prefere há um chopp bem gelado. As mesinhas externas ficam...Mais,44,0,0,0,0,0,0,0,0,0
227,Boa comida! Garçons atrapalhados!,O forte da casa são os galetos que são servidos em sistema de rodízio. Optamos por uma picanha  estava uma delícia! Garçons meio atrapalhados.,33,0,0,0,0,0,0,0,0,0
228,Mesmo padrão,A loja tem o mesmo padrão da franquia onde o café não é excepcional. Aqui o atendimento é satisfatório em comparação com as outras unidades que conheço e que não volto,12,0,0,0,0,0,0,0,0,0
229,Se tu tiveres algo melhor pra fazer...,Nada de mais. Preços padrão Fran's com aquele cardápio meio palha. Nada incrível. Bom atendimento e preços altos.,38,0,0,0,0,0,0,0,0,0
230,Bom café em shopping,Muito bom ambiente tendo área interna e externa  os funcionários foram muito atenciosos e o café assim como os salgados solicitados estavam muito bom.,20,0,0,0,0,0,0,0,0,0
231,Ótima cafeteria.,A casa oferece 2 ambientes distintos: salão interno e varandão. Ótimo atendimento  varias opções de diferentes tipos de café  lanche e tortas salgadas e doce. Vale a visita.,16,0,0,0,0,0,0,0,0,0
232,Franccino maravilhoso ,O melhor Franccino (café gelado) da cidade! Atendimento excelente. Cardápio com muita opção e comida de ótima qualidade.,22,0,0,0,0,0,0,0,0,0
233,Excelente.,Atendimento excelente e pizzas muito gostosas. Além dos preços serem ótimos  claro! Os sanduíches também são uma delícia. Voltarei com certeza!,10,0,0,0,0,0,0,0,0,0
234,Custo-benefício,Excelente custo-benefício. A pizza não é lá essas maravilhas. Mas pelo preço  ta valendo. O açaí é muito bom. Sanduiches são Ok. Recomendo pra quem não quer gastar muito.,15,0,0,0,0,0,0,0,0,0
235,Comida deliciosa,Comida boa  preco justo  espaco um pouco pequeno  fica dentro de um hotel de nivel medio  muito aconchegante.,16,0,0,0,0,0,0,0,0,0
236,Ambiente refinado e muitas delícias no cardápio!,Ambiente muito bem decorado  com boa música de fundo e um cardápio recheado de delícias. O croissant de Brie com presunto Parma é espetacular. Não sou muito de comer doces  mas tem muita coisa de encher os olhos. Minha esposa comeu um croissant de brie...Mais,48,0,0,0,0,0,0,0,0,0
